{
  "release_id": "release-0.2.0-candidate",
  "semantic_version": "0.2.0",
  "schema_version": "1.0.0",
  "data_version": "0.0.0",
  "content_version": "0.1.0",
  "release_date": null,
  "included_batch_ids": [],
  "included_record_counts": {
    "people": 0,
    "organization-references": 0,
    "book-works": 0,
    "book-editions": 0,
    "sources": 0,
    "statements": 0,
    "propositions": 0,
    "stances": 0,
    "topics": 0,
    "debates": 0,
    "dossiers": 0,
    "trends": 0,
    "protocols": 0,
    "batches": 0,
    "reviews": 0,
    "corrections": 0,
    "releases": 0
  },
  "checksums": {
    "exports/bibliographies/README.md": "9234346ea9b10467ff36dc51f97ea54591049fd84e1fd610aa754243b6462fb8",
    "exports/citations/records.bib": "b129952ae22cf77632660b28b1a59008a5a4b0557f485a202dc7c83bef0a9514",
    "exports/csv/batches.csv": "8c7784e06705eeb046533c177c7c6af5a7eb89d6b0b912f82808e3a4ab1995e4",
    "exports/csv/book-editions.csv": "8c7784e06705eeb046533c177c7c6af5a7eb89d6b0b912f82808e3a4ab1995e4",
    "exports/csv/book-works.csv": "8c7784e06705eeb046533c177c7c6af5a7eb89d6b0b912f82808e3a4ab1995e4",
    "exports/csv/corrections.csv": "8c7784e06705eeb046533c177c7c6af5a7eb89d6b0b912f82808e3a4ab1995e4",
    "exports/csv/debates.csv": "8c7784e06705eeb046533c177c7c6af5a7eb89d6b0b912f82808e3a4ab1995e4",
    "exports/csv/dossiers.csv": "8c7784e06705eeb046533c177c7c6af5a7eb89d6b0b912f82808e3a4ab1995e4",
    "exports/csv/organization-references.csv": "8c7784e06705eeb046533c177c7c6af5a7eb89d6b0b912f82808e3a4ab1995e4",
    "exports/csv/people.csv": "8c7784e06705eeb046533c177c7c6af5a7eb89d6b0b912f82808e3a4ab1995e4",
    "exports/csv/propositions.csv": "8c7784e06705eeb046533c177c7c6af5a7eb89d6b0b912f82808e3a4ab1995e4",
    "exports/csv/protocols.csv": "8c7784e06705eeb046533c177c7c6af5a7eb89d6b0b912f82808e3a4ab1995e4",
    "exports/csv/releases.csv": "8c7784e06705eeb046533c177c7c6af5a7eb89d6b0b912f82808e3a4ab1995e4",
    "exports/csv/reviews.csv": "8c7784e06705eeb046533c177c7c6af5a7eb89d6b0b912f82808e3a4ab1995e4",
    "exports/csv/sources.csv": "8c7784e06705eeb046533c177c7c6af5a7eb89d6b0b912f82808e3a4ab1995e4",
    "exports/csv/stances.csv": "8c7784e06705eeb046533c177c7c6af5a7eb89d6b0b912f82808e3a4ab1995e4",
    "exports/csv/statements.csv": "8c7784e06705eeb046533c177c7c6af5a7eb89d6b0b912f82808e3a4ab1995e4",
    "exports/csv/topics.csv": "8c7784e06705eeb046533c177c7c6af5a7eb89d6b0b912f82808e3a4ab1995e4",
    "exports/csv/trends.csv": "8c7784e06705eeb046533c177c7c6af5a7eb89d6b0b912f82808e3a4ab1995e4",
    "exports/graphml/graph.graphml": "37776c7d8e5ad090874effed8b195d2f85b5f19d3e270f17e95dc889ab2cbb96",
    "exports/json/catalog.json": "df12f7c90bcf89843b398888cee241b61103ccdd67d389bea0e1a1a9ce46abd2",
    "exports/ndjson/catalog.ndjson": "e3b0c44298fc1c149afbf4c8996fb92427ae41e4649b934ca495991b7852b855"
  },
  "release_fingerprint": "3527bda659346bd2f07569f394d14bc43f2065ef4e5dc800d6c10ca7ea747d3b",
  "upstream_crosswalk_versions": {
    "cxo-ecosystem-index": "45ca4066fc00",
    "executive-ai-research": "d205a6b2e6f4",
    "executive-communities-index": "ba9bab57a774",
    "executive-community-playbook": "2a0936b00c75",
    "openfutureforum-github-profile": "c3fe1e9e27cc",
    "openfutureforum-pages-root": "12505350a4d9"
  },
  "known_limitations": [
    "No approved batch IDs were supplied or discovered.",
    "No named human production-release approval is present.",
    "The candidate contains no published production research records.",
    "The target version was inferred from the prior 0.1.0 framework because the prompt placeholder was unresolved.",
    "Deployment and live verification have not occurred."
  ],
  "changelog": [
    "Prepared a zero-record release candidate and approval-gate audit.",
    "Kept every staging and proposal-only record out of production.",
    "Preserved the 1.0.0 schema and existing public framework fingerprint."
  ],
  "approval_status": "blocked_pending_named_human_approval_and_explicit_batch_set",
  "workflow_status": "publication_recommended",
  "machine_review_status": "ready_for_human_review",
  "human_review_status": "pending",
  "reviewed_by": null,
  "reviewed_at": null,
  "provenance": [
    {
      "source_url": "https://github.com/OpenFutureForum/executive-intelligence-index",
      "accessed_at": "2026-08-16",
      "retrieval_method": "local repository release audit",
      "exact_locator": "release/0.2.0 candidate branch",
      "content_hash": null,
      "batch_id": "RELEASE-0.2.0",
      "prompt_id": "OEII-RELEASE-MANAGER",
      "prompt_version": "2.0",
      "notes": "Machine-prepared candidate only; not a published release."
    }
  ],
  "revision_history": [
    {
      "changed_at": "2026-08-16T00:00:00Z",
      "changed_by": "Codex release manager",
      "summary": "Created a release hold record without changing human review status.",
      "batch_id": "RELEASE-0.2.0"
    }
  ]
}
